{
  "schema_version": "1.0.0",
  "record_type": "source",
  "id": "nct-07144527",
  "name": "Nicotinamide mononucleotide supplementation for exercise tolerance improvement in healthy older adults",
  "short_name": "NMN exercise tolerance registry",
  "summary": "ClinicalTrials.gov recruiting no-results registry testing NMN and a combination supplement arm for exercise tolerance in healthy older adults.",
  "source_type": "trial_registry",
  "authors": [
    "ClinicalTrials.gov"
  ],
  "venue": "ClinicalTrials.gov",
  "year": 2025,
  "published_on": "2025-08-27",
  "registry_ids": [
    "NCT07144527"
  ],
  "urls": [
    "https://clinicaltrials.gov/study/NCT07144527"
  ],
  "tags": [
    "nad-and-redox-restoration",
    "nicotinamide-mononucleotide",
    "nmn",
    "exercise-tolerance",
    "trial-watch",
    "no-results"
  ]
}
