{
  "schema_version": "1.0.0",
  "record_type": "source",
  "id": "pmid-41803341",
  "name": "Effects of daily multivitamin-multimineral and cocoa extract supplementation on epigenetic aging clocks in the COSMOS randomized clinical trial",
  "short_name": "COSMOS MVM cocoa DNAm clock trial",
  "summary": "A prespecified ancillary study of the COSMOS randomized trial evaluating daily multivitamin-multimineral and cocoa extract effects on DNA-methylation aging clocks over two years.",
  "source_type": "journal_article",
  "authors": [
    "Li S",
    "Hamaya R",
    "Zhu H",
    "Chen BH",
    "Pereira AC",
    "Ivey KL",
    "Rist PM",
    "Manson JE",
    "Dong Y",
    "Sesso HD"
  ],
  "venue": "Nature Medicine",
  "year": 2026,
  "published_on": "2026-03-09",
  "doi": "10.1038/s41591-026-04239-3",
  "pmid": "41803341",
  "urls": [
    "https://pubmed.ncbi.nlm.nih.gov/41803341/",
    "https://doi.org/10.1038/s41591-026-04239-3"
  ],
  "tags": [
    "dna-methylation-and-epigenome-restoration",
    "multivitamin-multimineral",
    "cocoa-extract",
    "human-rct",
    "epigenetic-clock"
  ]
}
