{
  "schema_version": "1.0.0",
  "record_type": "source",
  "id": "pmid-28273655",
  "name": "New agents that target senescent cells: the flavone, fisetin, and the BCL-X(L) inhibitors, A1331852 and A1155463",
  "short_name": "Fisetin senolytic discovery",
  "summary": "2017 Aging report identifying fisetin and selective BCL-XL inhibitors as senolytic candidates in cell assays while emphasizing cell-type specificity and navitoclax-related hematologic toxicity as a translation boundary.",
  "source_type": "journal_article",
  "authors": [
    "Zhu Y",
    "Doornebal EJ",
    "Pirtskhalava T",
    "Giorgadze N",
    "Wentworth M",
    "Kirkland JL"
  ],
  "venue": "Aging",
  "year": 2017,
  "published_on": "2017-03-08",
  "doi": "10.18632/aging.101202",
  "pmid": "28273655",
  "urls": [
    "https://pubmed.ncbi.nlm.nih.gov/28273655/",
    "https://doi.org/10.18632/aging.101202"
  ],
  "tags": [
    "senolytics",
    "fisetin",
    "bcl-xl",
    "in-vitro",
    "translation-boundary",
    "coverage-repair"
  ]
}
