{
  "schema_version": "1.0.0",
  "record_type": "source",
  "id": "nature-aging-klotho-nhp-2023",
  "name": "Longevity factor klotho enhances cognition in aged nonhuman primates",
  "short_name": "Klotho aged nonhuman primate cognition",
  "summary": "An open-access Nature Aging brief communication testing systemic rhesus klotho protein in mice and aged rhesus macaques, including spatial memory testing after a single subcutaneous klotho dose.",
  "source_type": "journal_article",
  "authors": [
    "Castner SA",
    "Gupta S",
    "Wang D",
    "Moreno AJ",
    "Park C",
    "Chen C",
    "Poon Y",
    "Groen A",
    "Greenberg K",
    "David N",
    "Boone T",
    "Baxter MG",
    "Williams GV",
    "Dubal DB"
  ],
  "venue": "Nature Aging",
  "year": 2023,
  "published_on": "2023-07-03",
  "doi": "10.1038/s43587-023-00441-x",
  "urls": [
    "https://www.nature.com/articles/s43587-023-00441-x",
    "https://doi.org/10.1038/s43587-023-00441-x"
  ],
  "tags": [
    "neuroendocrine-and-systemic-signal-reset",
    "klotho",
    "nonhuman-primate",
    "animal",
    "cognition"
  ]
}
