{
  "schema_version": "1.0.0",
  "record_type": "source",
  "id": "nct-06556706",
  "name": "Impact of Urolithin A (Mitopure) on Mitochondrial Quality in Muscle of Frail Older Adults.",
  "short_name": "Frail older adult urolithin A registry",
  "summary": "ClinicalTrials.gov registry for a completed randomized quadruple-masked 26-participant frail-older-adult urolithin A study of mitochondrial-quality muscle endpoints; no posted results were present in the API snapshot checked on 2026-06-10.",
  "source_type": "trial_registry",
  "year": 2025,
  "published_on": "2025-05-28",
  "registry_ids": [
    "NCT06556706"
  ],
  "urls": [
    "https://clinicaltrials.gov/study/NCT06556706"
  ],
  "tags": [
    "microbiome-metabolite-restoration",
    "mitophagy-enhancers",
    "urolithin-a",
    "frailty",
    "trial-registry",
    "no-posted-results",
    "coverage-repair"
  ]
}
