{
  "schema_version": "1.0.0",
  "record_type": "source",
  "id": "pmid-40944126",
  "name": "Multi-Species Synbiotic Supplementation Enhances Gut Microbial Diversity, Increases Urolithin A and Butyrate Production, and Reduces Inflammation in Healthy Adults: A Randomized, Placebo-Controlled Trial.",
  "short_name": "DS-01 urolithin A and butyrate RCT",
  "summary": "A 32-participant randomized placebo-controlled healthy-adult synbiotic trial reporting increased urinary urolithin A, fecal butyrate in low-baseline producers, and lower systemic inflammation markers over 91 days.",
  "source_type": "journal_article",
  "authors": [
    "Napier BA",
    "Allegretti JR",
    "Feuerstadt P",
    "Kelly CR",
    "Van Hise NW",
    "Jager R",
    "Kassam Z",
    "Reid G"
  ],
  "venue": "Nutrients",
  "year": 2025,
  "published_on": "2025-08-23",
  "doi": "10.3390/nu17172734",
  "pmid": "40944126",
  "urls": [
    "https://pubmed.ncbi.nlm.nih.gov/40944126/",
    "https://doi.org/10.3390/nu17172734"
  ],
  "tags": [
    "microbiome-metabolite-restoration",
    "synbiotic",
    "urolithin-a",
    "butyrate",
    "human-rct"
  ]
}
