{
  "schema_version": "1.0.0",
  "record_type": "source",
  "id": "nct-02570672",
  "name": "Metformin for Preventing Frailty in High-risk Older Adults",
  "short_name": "NCT02570672 metformin frailty-prevention registry",
  "summary": "ClinicalTrials.gov registry record for a completed phase 2 metformin frailty-prevention trial in adults 65 to 90 years old with posted results as of the August 6, 2025 update.",
  "source_type": "trial_registry",
  "authors": [
    "The University of Texas Health Science Center at San Antonio",
    "National Institute on Aging (NIA)"
  ],
  "venue": "ClinicalTrials.gov",
  "year": 2015,
  "published_on": "2015-10-07",
  "registry_ids": [
    "NCT02570672"
  ],
  "urls": [
    "https://clinicaltrials.gov/study/NCT02570672"
  ],
  "tags": [
    "ampk-and-metabolic-modulators",
    "metformin",
    "trial-registry",
    "frailty",
    "posted-results"
  ]
}
