{
  "schema_version": "1.0.0",
  "record_type": "source",
  "id": "pmid-28622510",
  "name": "Microbial Genetic Composition Tunes Host Longevity",
  "short_name": "Engineered E. coli longevity screen",
  "summary": "A 2017 Cell study using E. coli genetic perturbations to identify microbial genes and colanic acid biology that tune C. elegans longevity.",
  "source_type": "journal_article",
  "authors": [
    "Han B",
    "Sivaramakrishnan P",
    "Lin CJ",
    "Neve IAA",
    "He J",
    "Tay LWR",
    "Sowa JN",
    "Sizovs A",
    "Du G",
    "Wang J",
    "Herman C",
    "Wang MC"
  ],
  "venue": "Cell",
  "year": 2017,
  "published_on": "2017-06-15",
  "doi": "10.1016/j.cell.2017.05.036",
  "pmid": "28622510",
  "urls": [
    "https://pubmed.ncbi.nlm.nih.gov/28622510/",
    "https://doi.org/10.1016/j.cell.2017.05.036"
  ],
  "tags": [
    "live-biotherapeutics-and-engineered-microbes",
    "engineered-microbes",
    "e-coli",
    "colanic-acid",
    "c-elegans",
    "lifespan"
  ]
}
