{
  "schema_version": "1.0.0",
  "record_type": "source",
  "id": "pmid-24582957",
  "name": "The SIRT1 activator SRT1720 extends lifespan and improves health of mice fed a standard diet",
  "short_name": "SRT1720 standard-diet mouse lifespan",
  "summary": "A Cell Reports study of long-term SRT1720 supplementation in male mice on standard diet, reporting increased mean lifespan and improved healthspan/metabolic markers.",
  "source_type": "journal_article",
  "authors": [
    "Mitchell SJ",
    "Martin-Montalvo A",
    "Mercken EM",
    "Palacios HH",
    "Bernier M",
    "de Cabo R"
  ],
  "venue": "Cell Reports",
  "year": 2014,
  "published_on": "2014-03-13",
  "doi": "10.1016/j.celrep.2014.01.031",
  "pmid": "24582957",
  "urls": [
    "https://pubmed.ncbi.nlm.nih.gov/24582957/",
    "https://doi.org/10.1016/j.celrep.2014.01.031"
  ],
  "tags": [
    "chromatin-and-histone-modulation",
    "sirt1",
    "srt1720",
    "mouse-lifespan"
  ]
}
