{
  "schema_version": "1.0.0",
  "record_type": "source",
  "id": "pmid-36266373",
  "name": "Pax7+ Satellite Cells in Human Skeletal Muscle After Exercise: A Systematic Review and Meta-analysis",
  "short_name": "Human exercise Pax7 satellite-cell meta-analysis",
  "summary": "A systematic review and meta-analysis of human exercise studies measuring Pax7+ skeletal-muscle satellite cells.",
  "source_type": "journal_article",
  "authors": [
    "Dewi L",
    "Lin YC",
    "Nicholls A",
    "Condello G",
    "Huang CY",
    "Kuo CH"
  ],
  "venue": "Sports Medicine",
  "year": 2023,
  "published_on": "2022-10-20",
  "doi": "10.1007/s40279-022-01767-z",
  "pmid": "36266373",
  "urls": [
    "https://pubmed.ncbi.nlm.nih.gov/36266373/",
    "https://doi.org/10.1007/s40279-022-01767-z"
  ],
  "tags": [
    "stem-cell-rejuvenation",
    "human",
    "exercise",
    "satellite-cells"
  ]
}
