{
  "schema_version": "1.0.0",
  "record_type": "source",
  "id": "pmid-37486024",
  "name": "Disuse-induced muscle fibrosis, cellular senescence, and senescence-associated secretory phenotype in older adults are alleviated during re-ambulation with metformin pre-treatment",
  "short_name": "Metformin older-adult disuse senescence trial",
  "summary": "A controlled older-adult bed-rest and re-ambulation study testing whether metformin pre-treatment alters skeletal-muscle fibrosis, cellular senescence, and SASP markers.",
  "source_type": "journal_article",
  "authors": [
    "Petrocelli JJ",
    "McKenzie AI",
    "de Hart NMMP",
    "Reidy PT",
    "Mahmassani ZS",
    "Keeble AR",
    "Kaput KL",
    "Wahl MP",
    "Rondina MT",
    "Marcus RL",
    "Welt CK",
    "Holland WL",
    "Funai K",
    "Fry CS",
    "Drummond MJ"
  ],
  "venue": "Aging Cell",
  "year": 2023,
  "published_on": "2023-07-24",
  "doi": "10.1111/acel.13936",
  "pmid": "37486024",
  "registry_ids": [
    "NCT03107884"
  ],
  "urls": [
    "https://pubmed.ncbi.nlm.nih.gov/37486024/",
    "https://doi.org/10.1111/acel.13936",
    "https://pmc.ncbi.nlm.nih.gov/articles/PMC10652302/"
  ],
  "tags": [
    "senomorphics",
    "metformin",
    "human-trial",
    "skeletal-muscle",
    "sasp",
    "biomarker"
  ]
}
