{
  "schema_version": "1.0.0",
  "record_type": "source",
  "id": "calico-abbvie-aging-collaboration-2014",
  "name": "AbbVie and Calico announce a novel collaboration to accelerate the discovery, development, and commercialization of new therapies",
  "short_name": "Calico-AbbVie aging collaboration",
  "summary": "Calico and AbbVie press release announcing an R&D collaboration for age-related diseases, including a planned Bay Area R&D facility and potential co-investment of up to $1.5 billion.",
  "source_type": "company_update",
  "authors": [
    "Calico",
    "AbbVie"
  ],
  "venue": "Calico Press Release",
  "year": 2014,
  "published_on": "2014-09-03",
  "urls": [
    "https://www.calicolabs.com/press/abbvie-and-calico-announce-a-novel-collaboration-to-accelerate-the-discovery-development-and-commercialization-of-new-therapies/"
  ],
  "tags": [
    "calico",
    "abbvie",
    "aging",
    "partnership",
    "field-activity"
  ]
}
