{
  "schema_version": "1.0.0",
  "record_type": "source",
  "id": "pmid-21325617",
  "name": "Growth hormone receptor deficiency is associated with a major reduction in pro-aging signaling, cancer, and diabetes in humans.",
  "short_name": "Ecuadorian GHRD cohort",
  "summary": "A 22-year Ecuadorian growth-hormone-receptor-deficiency cohort study reporting severe IGF-1 deficiency, low insulin and HOMA-IR, one nonlethal malignancy, and no diabetes among affected individuals versus higher cancer and diabetes prevalence in relatives.",
  "source_type": "journal_article",
  "authors": [
    "Guevara-Aguirre J",
    "Balasubramanian P",
    "Guevara-Aguirre M",
    "Wei M",
    "Madia F",
    "Cheng CW",
    "Hwang D",
    "Martin-Montalvo A"
  ],
  "venue": "Science Translational Medicine",
  "year": 2011,
  "published_on": "2011-02-16",
  "doi": "10.1126/scitranslmed.3001845",
  "pmid": "21325617",
  "urls": [
    "https://pubmed.ncbi.nlm.nih.gov/21325617/",
    "https://doi.org/10.1126/scitranslmed.3001845"
  ],
  "tags": [
    "insulin-igf-axis-modulation",
    "growth-hormone-receptor-deficiency",
    "igf-1",
    "human-natural-experiment"
  ]
}
