{
  "schema_version": "1.0.0",
  "record_type": "source",
  "id": "newlimit-formation-2021",
  "name": "Announcing NewLimit, a company built to extend human healthspan",
  "short_name": "NewLimit formation",
  "summary": "NewLimit founder post announcing the company and its focus on extending human healthspan by identifying and reversing epigenetic drivers of aging.",
  "source_type": "company_update",
  "authors": [
    "NewLimit"
  ],
  "venue": "NewLimit Blog",
  "year": 2021,
  "published_on": "2021-12-11",
  "urls": [
    "https://blog.newlimit.com/p/announcing-newlimit-a-company-built"
  ],
  "tags": [
    "newlimit",
    "epigenetic-reprogramming",
    "healthspan",
    "company-update",
    "field-activity"
  ]
}
