{
  "schema_version": "1.0.0",
  "record_type": "source",
  "id": "pmid-22728514",
  "name": "Transfer of intestinal microbiota from lean donors increases insulin sensitivity in individuals with metabolic syndrome",
  "short_name": "Lean-donor FMT metabolic syndrome",
  "summary": "A 2012 Gastroenterology randomized study reporting that lean-donor intestinal microbiota infusion increased insulin sensitivity and butyrate-producing intestinal microbiota in male recipients with metabolic syndrome at six weeks.",
  "source_type": "journal_article",
  "authors": [
    "Vrieze A",
    "Van Nood E",
    "Holleman F",
    "Salojarvi J",
    "Kootte RS",
    "Stroes ES",
    "Nieuwdorp M"
  ],
  "venue": "Gastroenterology",
  "year": 2012,
  "published_on": "2012-06-20",
  "doi": "10.1053/j.gastro.2012.06.031",
  "pmid": "22728514",
  "urls": [
    "https://pubmed.ncbi.nlm.nih.gov/22728514/",
    "https://doi.org/10.1053/j.gastro.2012.06.031"
  ],
  "tags": [
    "ecosystem-replacement",
    "human-biomarker",
    "metabolic-syndrome",
    "insulin-sensitivity"
  ]
}
