{
  "schema_version": "1.0.0",
  "record_type": "source",
  "id": "pmid-39628322",
  "name": "Autologous mitochondrial transplant for acute cerebral ischemia: Phase 1 trial results and review",
  "short_name": "Acute cerebral ischemia autologous mitochondrial transplant phase 1",
  "summary": "A phase 1 report of autologous mitochondrial transplantation during mechanical thrombectomy for acute ischemic stroke, with primary emphasis on acute feasibility and safety.",
  "source_type": "journal_article",
  "authors": [
    "Walker M",
    "Levitt MR",
    "Federico EM",
    "Miralles FJ",
    "Levy SH",
    "Prijoles KL"
  ],
  "venue": "Journal of Cerebral Blood Flow and Metabolism",
  "year": 2024,
  "published_on": "2024-12-04",
  "doi": "10.1177/0271678X241305230",
  "pmid": "39628322",
  "urls": [
    "https://pubmed.ncbi.nlm.nih.gov/39628322/",
    "https://doi.org/10.1177/0271678X241305230",
    "https://pmc.ncbi.nlm.nih.gov/articles/PMC11615905/"
  ],
  "tags": [
    "mitochondrial-delivery-and-transplantation",
    "autologous-mitochondrial-transplantation",
    "human",
    "stroke",
    "phase1",
    "safety"
  ]
}
