{
  "schema_version": "1.0.0",
  "record_type": "source",
  "id": "nct-02766790",
  "name": "Effect of TA-65MD on Healthy Volunteers",
  "short_name": "TA-65MD healthy-volunteer registry",
  "summary": "ClinicalTrials.gov randomized double-masked TA-65MD registry in healthy adults aged 45 to 75 years, listed with unknown overall status, last-known recruiting status, estimated enrollment of 500, and no posted results in the June 10, 2026 API view.",
  "source_type": "trial_registry",
  "authors": [
    "Telomerase Activation Sciences, Inc"
  ],
  "venue": "ClinicalTrials.gov",
  "year": 2016,
  "published_on": "2016-05-10",
  "registry_ids": [
    "NCT02766790"
  ],
  "urls": [
    "https://clinicaltrials.gov/study/NCT02766790"
  ],
  "tags": [
    "telomerase-restoration",
    "ta-65",
    "trial-registry",
    "no-results",
    "coverage-repair"
  ]
}
