{
  "schema_version": "1.0.0",
  "record_type": "source",
  "id": "pmid-39039808",
  "name": "Mitochondrial Transplantation Promotes Protective Effector and Memory CD4+ T Cell Response During Mycobacterium Tuberculosis Infection and Diminishes Exhaustion and Senescence in Elderly CD4+ T cells",
  "short_name": "Mito-transfer elderly CD4 T-cell study",
  "summary": "A peer-reviewed study of mitochondrial transfer in aged mouse CD4+ T-cell models and ex vivo CD4+ T cells from elderly humans, with immune activation, cytokine, exhaustion, and senescence endpoints.",
  "source_type": "journal_article",
  "authors": [
    "Headley CA",
    "Gautam S",
    "Olmo-Fontanez A",
    "Garcia-Vilanova A",
    "Dwivedi V",
    "Schami A",
    "Weintraub S",
    "Tsao PS",
    "Torrelles JB",
    "Turner J"
  ],
  "venue": "Advanced Science",
  "year": 2024,
  "published_on": "2024-07-22",
  "doi": "10.1002/advs.202401077",
  "pmid": "39039808",
  "urls": [
    "https://pubmed.ncbi.nlm.nih.gov/39039808/",
    "https://doi.org/10.1002/advs.202401077",
    "https://pmc.ncbi.nlm.nih.gov/articles/PMC11423092/"
  ],
  "tags": [
    "mitochondrial-delivery-and-transplantation",
    "ex-vivo-mitochondrial-transfer",
    "elderly-human-cells",
    "aged-mice",
    "immune-senescence"
  ]
}
