{
  "schema_version": "1.0.0",
  "record_type": "source",
  "id": "pmid-32694802",
  "name": "The mitophagy activator urolithin A is safe and induces a molecular signature of improved mitochondrial and cellular health in humans.",
  "short_name": "Urolithin A first-in-human",
  "summary": "A first-in-human urolithin A study in healthy sedentary older adults reporting safety, bioavailability, and mitochondrial biomarker changes after repeated dosing.",
  "source_type": "journal_article",
  "authors": [
    "Andreux PA",
    "Blanco-Bose W",
    "Ryu D",
    "Burdet F",
    "Ibberson M",
    "Aebischer P",
    "Auwerx J",
    "Singh A",
    "Rinsch C"
  ],
  "venue": "Nature Metabolism",
  "year": 2019,
  "published_on": "2019-06-14",
  "doi": "10.1038/s42255-019-0073-4",
  "pmid": "32694802",
  "urls": [
    "https://pubmed.ncbi.nlm.nih.gov/32694802/",
    "https://doi.org/10.1038/s42255-019-0073-4"
  ],
  "tags": [
    "selective-autophagy-and-organelle-quality-control",
    "urolithin-a",
    "mitophagy",
    "human-biomarker"
  ]
}
