{
  "schema_version": "1.0.0",
  "record_type": "source",
  "id": "pmid-37118425",
  "name": "Effect of long-term caloric restriction on DNA methylation measures of biological aging in healthy adults from the CALERIE trial",
  "short_name": "CALERIE DNA methylation aging analysis",
  "summary": "A post hoc analysis of a two-year randomized caloric-restriction trial assessing DNA-methylation measures of biological aging in healthy adults without obesity.",
  "source_type": "journal_article",
  "authors": [
    "Waziry R",
    "Ryan CP",
    "Corcoran DL",
    "Huffman KM",
    "Kobor MS",
    "Kothari M",
    "Graf GH",
    "Kraus VB",
    "Kraus WE",
    "Lin DTS",
    "Pieper CF",
    "Ramaker ME",
    "Bhapkar M",
    "Das SK",
    "Ferrucci L",
    "Hastings WJ",
    "Kebbe M",
    "Parker DC",
    "Racette SB",
    "Shalev I",
    "Schilling B",
    "Belsky DW"
  ],
  "venue": "Nature Aging",
  "year": 2023,
  "published_on": "2023-02-09",
  "doi": "10.1038/s43587-022-00357-y",
  "pmid": "37118425",
  "urls": [
    "https://pubmed.ncbi.nlm.nih.gov/37118425/",
    "https://doi.org/10.1038/s43587-022-00357-y"
  ],
  "tags": [
    "dna-methylation-and-epigenome-restoration",
    "caloric-restriction",
    "human-rct",
    "epigenetic-clock"
  ]
}
