{
  "schema_version": "1.0.0",
  "record_type": "source",
  "id": "pmid-41540161",
  "name": "Microbiota-derived indole-3-propionic acid extends lifespan in Drosophila and improves muscle and bone health in mice.",
  "short_name": "IPA mouse muscle and fly lifespan",
  "summary": "A 2026 GeroScience study testing indole-3-propionic acid in aged mice and Drosophila, reporting improved aged-mouse muscle and bone measures and genotype- or sex-specific fly lifespan extension.",
  "source_type": "journal_article",
  "authors": [
    "Vyavahare S",
    "Berger F",
    "Swint SG",
    "Mendhe B",
    "Shukla M",
    "Duchesne I",
    "Zhong R",
    "Cooley MA"
  ],
  "venue": "GeroScience",
  "year": 2026,
  "published_on": "2026-02-01",
  "doi": "10.1007/s11357-025-02078-7",
  "pmid": "41540161",
  "urls": [
    "https://pubmed.ncbi.nlm.nih.gov/41540161/",
    "https://doi.org/10.1007/s11357-025-02078-7"
  ],
  "tags": [
    "microbiome-metabolite-restoration",
    "indole-3-propionic-acid",
    "animal",
    "muscle",
    "lifespan"
  ]
}
