{
  "schema_version": "1.0.0",
  "record_type": "source",
  "id": "pmid-39465400",
  "name": "Placental MSC-derived extracellular vesicles in knee osteoarthritis placebo-controlled trial",
  "short_name": "Placental MSC EV OA RCT",
  "summary": "A randomized triple-blind placebo-controlled trial testing a single intra-articular placental mesenchymal stromal cell-derived extracellular vesicle injection in knee osteoarthritis.",
  "source_type": "journal_article",
  "authors": [
    "Bolandnazar NS",
    "Raeissadat SA",
    "Haghighatkhah H",
    "Rayegani SM",
    "Oshnari RS",
    "Keshel SH",
    "Zahraei M",
    "Aalipour K"
  ],
  "venue": "BMC Musculoskeletal Disorders",
  "year": 2024,
  "published_on": "2024-10-28",
  "doi": "10.1186/s12891-024-07979-w",
  "pmid": "39465400",
  "registry_ids": [
    "IRCT20210423051054N1"
  ],
  "urls": [
    "https://pubmed.ncbi.nlm.nih.gov/39465400/",
    "https://doi.org/10.1186/s12891-024-07979-w"
  ],
  "tags": [
    "extracellular-vesicle-and-secretome-therapies",
    "msc-evs",
    "osteoarthritis",
    "human"
  ]
}
