{
  "schema_version": "1.0.0",
  "record_type": "source",
  "id": "pmid-29036257",
  "name": "Improvement of Actinic Keratoses Using Topical DNA Repair Enzymes: A Randomized Placebo-Controlled Trial",
  "short_name": "Topical DNA repair enzyme AK RCT",
  "summary": "A small randomized placebo-controlled trial testing topical DNA repair enzyme lotion in patients with actinic keratoses.",
  "source_type": "journal_article",
  "authors": [
    "Stoddard M",
    "Herrmann J",
    "Moy L",
    "Moy R"
  ],
  "venue": "Journal of Drugs in Dermatology",
  "year": 2017,
  "published_on": "2017-10-01",
  "pmid": "29036257",
  "urls": [
    "https://pubmed.ncbi.nlm.nih.gov/29036257/"
  ],
  "tags": [
    "dna-repair-enhancement",
    "topical-dna-repair-enzymes",
    "human-rct",
    "skin"
  ]
}
