{
  "schema_version": "1.0.0",
  "record_type": "source",
  "id": "pmid-39695227",
  "name": "Lithocholic acid phenocopies anti-ageing effects of calorie restriction.",
  "short_name": "Lithocholic acid CR-mimetic aging study",
  "summary": "A Nature study identifying lithocholic acid as a calorie-restriction-associated metabolite that activated AMPK and improved muscle regeneration, grip strength, running capacity, and invertebrate lifespan or healthspan readouts in model systems.",
  "source_type": "journal_article",
  "authors": [
    "Qu Q",
    "Chen Y",
    "Wang Y",
    "Long S",
    "Wang W",
    "Yang HY",
    "Li M",
    "Tian X"
  ],
  "venue": "Nature",
  "year": 2025,
  "published_on": "2024-12-18",
  "doi": "10.1038/s41586-024-08329-5",
  "pmid": "39695227",
  "urls": [
    "https://pubmed.ncbi.nlm.nih.gov/39695227/",
    "https://doi.org/10.1038/s41586-024-08329-5"
  ],
  "tags": [
    "microbiome-metabolite-restoration",
    "lithocholic-acid",
    "bile-acid",
    "ampk",
    "animal"
  ]
}
